{
  "$schema": "urn:operon:schema:runtime:v1:schema-manifest.schema.json",
  "manifestVersion": 1,
  "contractVersion": 1,
  "contractPolicy": {
    "inputs": "strict",
    "outputs": "additive",
    "deprecationRemoval": "runtime-v2"
  },
  "documents": [
    {
      "file": "capabilities.schema.json",
      "id": "urn:operon:schema:runtime:v1:capabilities.schema.json",
      "sha256": "04aad7ea7afb01f72adab917820696c76ba8ab35da9d419552b01bf19b199ea7"
    },
    {
      "file": "catalog.schema.json",
      "id": "urn:operon:schema:runtime:v1:catalog.schema.json",
      "sha256": "243d8a5738f000eba386bba97b8f552ddf92cd97e3e76536ea57f27d435a1e37"
    },
    {
      "file": "cli.schema.json",
      "id": "urn:operon:schema:runtime:v1:cli.schema.json",
      "sha256": "1d968c0c5716e497b85e8fc8af639f96e68e2d021e2d6b6315611b37246fe9a8"
    },
    {
      "file": "common.schema.json",
      "id": "urn:operon:schema:runtime:v1:common.schema.json",
      "sha256": "0ff866e4a1cf5a68f4778a2c083e2a17199a7563773dde5954fd59cbba8dfd67"
    },
    {
      "file": "compatibility.schema.json",
      "id": "urn:operon:schema:runtime:v1:compatibility.schema.json",
      "sha256": "46773bf48ef5210d10ce6e46b5c8a68d4672f01bea04e6760b4a186793f3ce28"
    },
    {
      "file": "context.schema.json",
      "id": "urn:operon:schema:runtime:v1:context.schema.json",
      "sha256": "79ff85ff7f078b063e3facaed812af0f4d7589d87f34a82ec9757b1e39931ef3"
    },
    {
      "file": "developer-api.schema.json",
      "id": "urn:operon:schema:runtime:v1:developer-api.schema.json",
      "sha256": "27c099c472830cc87d69ce59706b10508872d5a32d9e148a6704aa46f2a8c4dc"
    },
    {
      "file": "lifecycle.schema.json",
      "id": "urn:operon:schema:runtime:v1:lifecycle.schema.json",
      "sha256": "d3403e658248c06efc2fc4a46bfa94f11b28147c09b52952e2d13b809e25d708"
    },
    {
      "file": "mutation.schema.json",
      "id": "urn:operon:schema:runtime:v1:mutation.schema.json",
      "sha256": "3d756d096fbebe7cc905e9bdbae30c8c13f5d728e9507f5fe5414f159e59c499"
    },
    {
      "file": "read.schema.json",
      "id": "urn:operon:schema:runtime:v1:read.schema.json",
      "sha256": "330c4f353d91a911bb49d31109cd872ba0bcf1d686fd88579c1fd2515c50405e"
    },
    {
      "file": "schema-manifest.schema.json",
      "id": "urn:operon:schema:runtime:v1:schema-manifest.schema.json",
      "sha256": "14778a19dbf7687e5226a8ee069673957bcee8af819cc6e6b65b891c882ffece"
    },
    {
      "file": "timer.schema.json",
      "id": "urn:operon:schema:runtime:v1:timer.schema.json",
      "sha256": "f94a5921478209e72e0e0358cd9a16da3862a0c4ab95b6ec7597b2df04c4a633"
    }
  ],
  "entrypoints": [
    {
      "schemaId": "capability-advertisements",
      "ref": "urn:operon:schema:runtime:v1:lifecycle.schema.json#/$defs/capabilityAdvertisements",
      "file": "lifecycle.schema.json",
      "sha256": "d3403e658248c06efc2fc4a46bfa94f11b28147c09b52952e2d13b809e25d708",
      "stability": "stable"
    },
    {
      "schemaId": "capability-registry",
      "ref": "urn:operon:schema:runtime:v1:capabilities.schema.json#/$defs/capabilityRegistry",
      "file": "capabilities.schema.json",
      "sha256": "04aad7ea7afb01f72adab917820696c76ba8ab35da9d419552b01bf19b199ea7",
      "stability": "stable"
    },
    {
      "schemaId": "catalog-request",
      "ref": "urn:operon:schema:runtime:v1:catalog.schema.json#/$defs/request",
      "file": "catalog.schema.json",
      "sha256": "243d8a5738f000eba386bba97b8f552ddf92cd97e3e76536ea57f27d435a1e37",
      "stability": "stable"
    },
    {
      "schemaId": "cli-client-error",
      "ref": "urn:operon:schema:runtime:v1:cli.schema.json#/$defs/clientError",
      "file": "cli.schema.json",
      "sha256": "1d968c0c5716e497b85e8fc8af639f96e68e2d021e2d6b6315611b37246fe9a8",
      "stability": "stable"
    },
    {
      "schemaId": "cli-invocation",
      "ref": "urn:operon:schema:runtime:v1:cli.schema.json#/$defs/invocation",
      "file": "cli.schema.json",
      "sha256": "1d968c0c5716e497b85e8fc8af639f96e68e2d021e2d6b6315611b37246fe9a8",
      "stability": "stable"
    },
    {
      "schemaId": "cli-result",
      "ref": "urn:operon:schema:runtime:v1:cli.schema.json#/$defs/result",
      "file": "cli.schema.json",
      "sha256": "1d968c0c5716e497b85e8fc8af639f96e68e2d021e2d6b6315611b37246fe9a8",
      "stability": "stable"
    },
    {
      "schemaId": "compatibility-offer",
      "ref": "urn:operon:schema:runtime:v1:compatibility.schema.json#/$defs/offer",
      "file": "compatibility.schema.json",
      "sha256": "46773bf48ef5210d10ce6e46b5c8a68d4672f01bea04e6760b4a186793f3ce28",
      "stability": "stable"
    },
    {
      "schemaId": "compatibility-selection",
      "ref": "urn:operon:schema:runtime:v1:compatibility.schema.json#/$defs/selection",
      "file": "compatibility.schema.json",
      "sha256": "46773bf48ef5210d10ce6e46b5c8a68d4672f01bea04e6760b4a186793f3ce28",
      "stability": "stable"
    },
    {
      "schemaId": "context-pack",
      "ref": "urn:operon:schema:runtime:v1:read.schema.json#/$defs/contextPack",
      "file": "read.schema.json",
      "sha256": "330c4f353d91a911bb49d31109cd872ba0bcf1d686fd88579c1fd2515c50405e",
      "stability": "stable"
    },
    {
      "schemaId": "context-request",
      "ref": "urn:operon:schema:runtime:v1:read.schema.json#/$defs/contextRequest",
      "file": "read.schema.json",
      "sha256": "330c4f353d91a911bb49d31109cd872ba0bcf1d686fd88579c1fd2515c50405e",
      "stability": "stable"
    },
    {
      "schemaId": "developer-api-access-failure",
      "ref": "urn:operon:schema:runtime:v1:developer-api.schema.json#/$defs/accessFailure",
      "file": "developer-api.schema.json",
      "sha256": "27c099c472830cc87d69ce59706b10508872d5a32d9e148a6704aa46f2a8c4dc",
      "stability": "stable"
    },
    {
      "schemaId": "developer-api-access-request",
      "ref": "urn:operon:schema:runtime:v1:developer-api.schema.json#/$defs/accessRequest",
      "file": "developer-api.schema.json",
      "sha256": "27c099c472830cc87d69ce59706b10508872d5a32d9e148a6704aa46f2a8c4dc",
      "stability": "stable"
    },
    {
      "schemaId": "developer-api-channel-status",
      "ref": "urn:operon:schema:runtime:v1:developer-api.schema.json#/$defs/channelStatus",
      "file": "developer-api.schema.json",
      "sha256": "27c099c472830cc87d69ce59706b10508872d5a32d9e148a6704aa46f2a8c4dc",
      "stability": "stable"
    },
    {
      "schemaId": "developer-mutation-apply-input",
      "ref": "urn:operon:schema:runtime:v1:developer-api.schema.json#/$defs/mutationApplyInput",
      "file": "developer-api.schema.json",
      "sha256": "27c099c472830cc87d69ce59706b10508872d5a32d9e148a6704aa46f2a8c4dc",
      "stability": "stable"
    },
    {
      "schemaId": "developer-mutation-execution-result",
      "ref": "urn:operon:schema:runtime:v1:developer-api.schema.json#/$defs/mutationExecutionResult",
      "file": "developer-api.schema.json",
      "sha256": "27c099c472830cc87d69ce59706b10508872d5a32d9e148a6704aa46f2a8c4dc",
      "stability": "stable"
    },
    {
      "schemaId": "developer-mutation-pending-recoveries-result",
      "ref": "urn:operon:schema:runtime:v1:developer-api.schema.json#/$defs/mutationPendingRecoveriesResult",
      "file": "developer-api.schema.json",
      "sha256": "27c099c472830cc87d69ce59706b10508872d5a32d9e148a6704aa46f2a8c4dc",
      "stability": "stable"
    },
    {
      "schemaId": "developer-mutation-preview-input",
      "ref": "urn:operon:schema:runtime:v1:developer-api.schema.json#/$defs/mutationPreviewInput",
      "file": "developer-api.schema.json",
      "sha256": "27c099c472830cc87d69ce59706b10508872d5a32d9e148a6704aa46f2a8c4dc",
      "stability": "stable"
    },
    {
      "schemaId": "developer-mutation-preview-result",
      "ref": "urn:operon:schema:runtime:v1:developer-api.schema.json#/$defs/mutationPreviewResult",
      "file": "developer-api.schema.json",
      "sha256": "27c099c472830cc87d69ce59706b10508872d5a32d9e148a6704aa46f2a8c4dc",
      "stability": "stable"
    },
    {
      "schemaId": "developer-mutation-recover-input",
      "ref": "urn:operon:schema:runtime:v1:developer-api.schema.json#/$defs/mutationRecoverInput",
      "file": "developer-api.schema.json",
      "sha256": "27c099c472830cc87d69ce59706b10508872d5a32d9e148a6704aa46f2a8c4dc",
      "stability": "stable"
    },
    {
      "schemaId": "entity-resolution-result",
      "ref": "urn:operon:schema:runtime:v1:read.schema.json#/$defs/entityResolutionResult",
      "file": "read.schema.json",
      "sha256": "330c4f353d91a911bb49d31109cd872ba0bcf1d686fd88579c1fd2515c50405e",
      "stability": "stable"
    },
    {
      "schemaId": "entity-resolve-request",
      "ref": "urn:operon:schema:runtime:v1:read.schema.json#/$defs/entityResolveRequest",
      "file": "read.schema.json",
      "sha256": "330c4f353d91a911bb49d31109cd872ba0bcf1d686fd88579c1fd2515c50405e",
      "stability": "stable"
    },
    {
      "schemaId": "field-catalog",
      "ref": "urn:operon:schema:runtime:v1:capabilities.schema.json#/$defs/fieldCatalog",
      "file": "capabilities.schema.json",
      "sha256": "04aad7ea7afb01f72adab917820696c76ba8ab35da9d419552b01bf19b199ea7",
      "stability": "stable"
    },
    {
      "schemaId": "mutation-apply-request",
      "ref": "urn:operon:schema:runtime:v1:mutation.schema.json#/$defs/mutationApplyRequest",
      "file": "mutation.schema.json",
      "sha256": "3d756d096fbebe7cc905e9bdbae30c8c13f5d728e9507f5fe5414f159e59c499",
      "stability": "stable"
    },
    {
      "schemaId": "mutation-preview-request",
      "ref": "urn:operon:schema:runtime:v1:mutation.schema.json#/$defs/mutationPreviewRequest",
      "file": "mutation.schema.json",
      "sha256": "3d756d096fbebe7cc905e9bdbae30c8c13f5d728e9507f5fe5414f159e59c499",
      "stability": "stable"
    },
    {
      "schemaId": "mutation-preview-result",